Question,Response
สุนัขตัวแรกรับบทเป็นเบนจี้ในภาพยนตร์เรื่อง Benji ที่ออกฉายในปี พ.ศ. 2517 มีชื่อว่าอะไร,ฮิกกิ้นส์
ลูนา 1 เป็นยานอวกาศลำแรกในโครงการลูนาของโซเวียต มีชื่อเรียกอีกชื่อว่าอะไร,เมชตา
ลูนา 1 เป็นยานอวกาศลำแรกในโครงการลูนาของโซเวียต สามารถสังเกตและตรวจวัดอะไรได้โดยตรง,ลมสุริยะ
กระทรวงโฆษณาแถลงข่าวและโฆษณาชวนเชื่อของนาซีเยอรมนี ก่อตั้งขึ้นในปี ค.ศ. ใด,ปี 1933
ห้องทำงานรูปไข่ สร้างขึ้นในสมัยอดีตประธานาธิบดีคนใดของสหรัฐอเมริกา,ประธานาธิบดีวิลเลียม เอช. ทัฟต์
เครื่องอิสริยาภรณ์ดารามหาปุตราเป็นเครื่องอิสริยาภรณ์ของประเทศอินโดนีเซียมีลำดับเกียรติเป็นอันดับที่เท่าไร,อันดับที่ 2
เครื่องอิสริยาภรณ์ดารามหาปุตรา เป็นเครื่องอิสริยาภรณ์ฯ ของประเทศอะไร,ประเทศอินโดนีเซีย
เรจโจเอมีเลียเป็นเมืองในแคว้นใดในภาคเหนือของประเทศอิตาลี,แคว้นเอมีเลีย-โรมัญญา
พิกซาร์สตูดิโอสร้างคอมพิวเตอร์แอนิแมชันสัญชาติอเมริกัน ตั้งอยู่ที่เมืองอะไร,เมืองเอเมอรีวิลล์
พิกซาร์ สตูดิโอสร้างคอมพิวเตอร์แอนิแมชันสัญชาติอเมริกัน ในปัจจุบันเป็นส่วนหนึ่งของบริษัทอะไร,บริษัทเดอะวอลต์ดิสนีย์
ไซเบอร์ซันเดย์ 2008 จัดแข่งขันในวันที่ 26 ตุลาคม พ.ศ. 2551 จัดที่ประเทศอะไร,สหรัฐอเมริกา
บัดดี้ นอกซ์ เป็นนักร้องชาวอะไร,ชาวอเมริกัน
บัดดี้ นอกซ์ มีผลงานเพลงที่เป็นที่รู้จักในช่วงปี ค.ศ. 1957 ชื่อเพลงว่าอะไร,"เพลง ""Party Doll"""
สภาเศรษฐกิจโลก หรือ WEF ก่อตั้งเมื่อปี พ.ศ. ใด,ปี พ.ศ. 2514
ใครเป็นผู้ตั้งสภาเศรษฐกิจโลกขึ้นในปี พ.ศ. 2514 โดยทุกปีจะมีการประชุมที่ประเทศสวิตเซอร์แลนด์,คลาอัส มาร์ติน สเควป(Klaus Martin Schwab)
ท่าอากาศยานสุโขทัย เปิดทำการครั้งแรกเมื่อไร,วันที่ 12 เมษายน พ.ศ. 2539
สแกนดาร์ เคนส์ เป็นนักแสดงประเทศอะไร,ประเทศอังกฤษ
ลีโอสเตเดียมเป็นสนามฟุตบอลเหย้าของสโมสรฟุตบอลบางกอกกล๊าสตั้งอยู่ที่จังหวัดอะไร,จังหวัดปทุมธานี
การแข่งขันฟุตบอลชิงแชมป์แห่งชาติยุโรปครั้งที่ 6 จัดขึ้นที่ประเทศอะไร,ประเทศอิตาลี
การแข่งขันฟุตบอลชิงแชมป์แห่งชาติยุโรป 1980 จัดการแข่งขันขึ้นเมื่อไร,วันที่ 11-22 มิถุนายน ค.ศ. 1980
ตลอดกาล เป็นอัลบั้มเพลงไทยชุดที่ 5 ของวงอะไร,วงคีรีบูน
โปรดิวเซอร์ของอัลบั้มตลอดกาล ของวงคีรีบูนคือใคร,คุณปราจีน ทรงเผ่า
เท็กแบ็คเดอะไนท์เป็นเพลงที่บันทึกเสียงโดยนักร้องชาวอเมริกันชื่อว่าอะไร,จัสติน ทิมเบอร์เลก
เท็กแบ็คเดอะไนท์ เพลงของ จัสติน ทิมเบอร์เลก ให้ดาวน์โหลดได้เมื่อไร,วันที่ 12 กรกฎาคม ค.ศ. 2013
อัณณา หชาเร ได้รับเหรียญอิสริยาภรณ์จากรัฐบาลประเทศอะไร,รัฐบาลอินเดีย
ทีมวอลเลย์บอลชายที่ได้เข้าแข่งในฐานะแชมป์โลกปี 2018 คือประเทศอะไร,โปแลน
นายกรัฐมนตรีหญิงคนแรกของอิสราเอลคือใคร,โกลดา เมอีร์
อางี้ หรือ วนิดา ตันติวิทยาพิทักษ์ จบชั้นมัธยมศึกษาจากโรงเรียนอะไร,โรงเรียนสตรีมหาพฤฒาราม
หลังจากหลบเข้าป่า วนิดา ตันติวิทยาพิทักษ์  กลับมาเรียนต่อกี่ปีจึงสำเร็จการศึกษา,3 ปี
ปิยะมาศ โมนยะกุลได้แสดงภาพยนตร์เรื่องแรกในปี 2515 กำกับโดยวินิจ ภักดีวิจิตร มีชื่อเรื่องว่าอะไร,ขัง 8
ลำไย ไหทองคำ นักร้องลูกทุ่งไทยมีชื่อจริงว่าอะไร,สุพรรณษา เวชกามา
ลำไย ไหทองคำ นักร้องลูกทุ่งของไทยเกิดที่จังหวัดอะไร,จังหวัดร้อยเอ็ด
บ้านเกิดของเซอร์ปีเตอร์ โรเบิร์ต แจ็กสัน อยู่ที่เมืองใดในประเทศนิวซีแลนด์,เมือง North Island
ภาพยนตร์เรื่อง The Lovely Bones ในปี 2009 กำกับโดยใคร,เซอร์ปีเตอร์ โรเบิร์ต แจ็กสัน
ทีมวอลเลย์บอลอาชีพของอินโดนีเซียที่ก่อตั้งในปี ค.ศ. 2002 ชื่อทีมว่าอะไร,ปาเลมบัง บัง ซุมเซล บาเบล
สนามเหย้าของทีมปาเลมบัง บัง ซุมเซล บาเบล มีชื่อสนามว่าอะไร,ปาเลมบังสปอร์ตฮอลล์
ประเทศอะไรเป็นเจ้าภาพจัดการแข่งขันฟุตบอลชิงแชมป์แห่งชาติยุโรป ครั้งที่ 7,ประเทศฝรั่งเศส
ช่วงเวลาใดที่เริ่มจัดการแข่งขันฟุตบอลชิงแชมป์แห่งชาติยุโรป 1984,วันที่ 12-27 มิถุนายน ค.ศ. 1984
นิศาชล ต้วมสูงเนิน เกิดในจังหวัดอะไร,จังหวัด อุดรธานี
นิศาชล ต้วมสูงเนิน เป็นนักแสดงสังกัดช่องอะไร,สถานีโทรทัศน์ไทยทีวีสีช่อง 3
มะม่วงเป็นพืชไม้ยืนต้นอยู่ในสกุลอะไร,สกุล Mangifera
ที่ตั้งของอุทยานแห่งชาติสิรินาถ อยู่ในจังหวัดอะไร,จังหวัดภูเก็ต
ไอเอ็นจีเป็นบริษัทในเนเธอร์แลนด์ที่ให้บริการเกี่ยวกับการเงิน มีสำนักงานใหญ่อยู่ที่เมืองใด,อัมสเตอร์ดัม
ในปี 2008 นิตยสารฟอร์บได้จัดอันดับให้บริษัทไอเอ็นจีมีขนาดใหญ่ติดอันดับที่เท่าไรของโลก,อันดับ 9 ของโลก
ท้าวสุนิมมิตเป็นจอมเทพของสวรรค์ที่มีชื่อว่าอะไร,นิมมานรดี
สวรรค์ที่อยู่ระหว่างชั้นดุสิตและชั้นปรนิมมิตวสวัตดี คือสวรรค์ชั้นอะไร,สวรรค์ชั้นนิมมานรดี
โยโกะ โอะโนะ ทำอาชีพอะไร,นักร้อง
งแพ จิน-ย็อง เกิดเมื่อไร,19 กุมภาพันธ์ ค.ศ. 1993
เพลง สเตย์วิธมี ประกอบละครเรื่อง ก็อบลิน คำสาปรักผู้พิทักษ์วิญญาณ  ใครเป็นผู้ขับร้อง,แพ จิน-ย็อง
สะพานที่สร้างข้ามช่องแคบบอสฟอรัสตะวันออกมีชื่อสะพานว่าอะไร,สะพานรุสสกี
สะพานรุสสกี เปิดใช้อย่างเป็นทางการโดยนายกรัฐมนตรีรัศเซียคนใด,นายกรัฐมนตรีรัสเซียดมีตรี เมดเวเดฟ
นักกีฬาหมากล้อมระดับอาชีพชาวจีนที่อาศัยอยู่ในประเทศญี่ปุ่นคือใคร,หลิน ไห่เฟิง
หลิน ไห่เฟิง มีชื่อเรียกอีกชื่อว่าอะไร,ริน ไคโฮ
นักมวยสากลชาวอาร์เจนตินาคนใดที่เสียชีวิตเมื่อ 22 พฤศจิกายน พ.ศ. 2520,ปัสกวัล นีโกลัส เปเรซ
การชกป้องกันแชมป์ครั้งที่ 11 ของปัสกวัล นีโกลัส เปเรซ แพ้ให้กับใคร,โผน กิ่งเพชร
เมืองกัวยากิลตั้งอยู่ฝั่งใดของแม่น้ำกัวยัส,ฝั่งตะวันตกของแม่น้ำกัวยัส
โลกรอญโญตั้งอยู่ริมฝั่งแม่น้ำเอโบรทางภาคเหนือของประเทศอะไร,ประเทศสเปน
ศูนย์กลางการผลิตไวน์ริโอฆาอยู่ที่จังหวัดอะไรในประเทศสเปน,จังหวัดโลกรอญโญ
บ้านเกิดของ อุเอะโนะ ฮิโกะมะ ช่างถ่ายภาพชาวญี่ปุ่น อยู่ที่ไหน,นะงะซะกิ
ใครคือบุคคลสำคัญในการถ่ายภาพของญี่ปุ่นในศตวรรษที่ 19,อุเอะโนะ
นายกรัฐมนตรีคนที่ 24 ของประเทศไทยคือใคร,พลเอกสุรยุทธ์ จุลานนท์
ภรรยาของนายกรัฐมนตรีคนที่ 24 ของประเทศไทยมีชื่อว่าอะไร,พันเอกหญิง ท่านผู้หญิง จิตรวดี จุลานนท์
ใครเป็นคนนำการปฏิบัติวิปัสสนากรรมฐานแบบยุบหนอ-พองหนอ มาเผยแพร่ในประเทศไทย,สมเด็จพระพุฒาจารย์
ลูกชายคนโตของนายพิมพ์ และนางแจ้ ดวงมาลา คือใคร,คำตา ดวงมาลา
พืชวงศ์แตงมีประมาณกี่ชนิด,960 ชนิด
ธนาคารที่ใหญ่ที่สุดของประเทศญี่ปุ่นคือธนาคารอะไร,ธนาคารโตเกียว-มิตซูบิชิ ยูเอฟเจ
นาคารโตเกียว-มิตซูบิชิ ยูเอฟเจ ถือหุ้นธนาคารกรุงศรีอยุธยาอยู่กี่เปอร์เซ็นต์,ถือหุ้น 76.88%
โทมัส เจคอบ ฮิลฟิเกอร์ เกิดที่เมืองอะไรในรัฐนิวยอร์ก,เมืองเอลมีรา (Elmira)
ส้มแปะ อยู่ในวงศ์พืชชื่อว่าอะไร,Ericaceae
ส้มแปะ มีชื่อเรียกในภาษากะเหรี่ยงเรียกว่าอะไร,เส่อแบละ
ลูกชายพ.ต.ท.ชัยยง ขำเปี่ยม และนางวันนา ขำเปี่ยม มีชื่อว่าอะไร,สหวิช ขำเปี่ยม
การคมนาคมของแคว้นมาร์เค ของประเทศอิตาลีในช่วงคริสต์ศตวรรษที่ 19 เดินทางด้วยวิธีใด,ทางรถไฟ
ยอดดอยที่มีความสูงที่สุดในประเทศไทยคือดอยอะไร,ดอยอินทนนท์
พระอัฐิของพระเจ้าอินทวิชยานนท์ส่วนหนึ่งอยู่ที่ดอยอะไรในจังหวัดเชียงใหม่,ดอยหลวง
ภาษาโตเบโล ที่ทั้งหมดกี่สำเนียง,มี 6 สำเนียง
เฮเลโวรูรู  เป็นหนึ่งในสำเนียงของภาษาอะไร,ภาษาโตเบโล
นักร้องนำวงเดอะสมิธส์ ของประเทศอังกฤษคือใคร,Morrissey
วงเดอะสมิธส์ วงดนตรีออลเทอร์นาทิฟร็อกจากแมนเซสเตอร์ ประเทศอังกฤษ ถูกยุบวงเมื่อปีใด,ปี 1987
ยุทธการที่ไลพ์ซิช เกิดขึ้นเมื่อไร,วันที่ 16 ถึง 19 ตุลาคม ค.ศ. 1813
หลังงจากพ่ายแพ้สงคารม ทำให้นโปเลียนถูกเนรเทศไปอยู่ที่เกาะอะไร,เกาะเอลบา
คำกล่าวทักทายของคนไทยที่ใช้เมื่อแรกพบกัน หรือเพื่อบอกลา คือคำว่าอะไร,สวัสดี
ผู้ที่ริเริ่มใช้คำว่า สวัสดี เป็นคำกล่าวทักทาย คือใคร,พระยาอุปกิตศิลปสาร (นิ่ม กาญจนาชีวะ)
อำเภอหัวไทร จังหวัดนครศรีธรรมราช ด้านทิศเหนือติดต่อกับอำเภออะไร,อำเภอปากพนัง
เครื่องราชอิสริยาภรณ์ชั้นสูงสุดที่ยงยุทธ มัยลาภได้รับมีชื่อว่าอะไร,ชั้นตริตาภรณ์มงกุฎไทย (ต.ม.)
ปืนไรเฟิลซุ่มยิงแบบ bullpup ผลิตออกมาในช่วงต้นยุค 1990 มีชื่อว่าอะไร,AWC G2
นักฟุตบอลของชิลีที่เล่นเกมมากที่สุด 84 เกมในระหว่างปี 1955 ถึง1968 คือใคร,เลโอเนล กีเยร์โม ซานเชซ ลีเนโรส
ลักษณ์นารา เปี้ยทา มีพี่น้องกี่คน,หนึ่งคน
ลักษณ์นารา เปี้ยทา เรียนคณะอะไร,คณะอักษรศาสตร์
เขตบริหารพิเศษฮ่องกง เข้าร่วมแข่งขันกีฬาโอลิมปิกฤดูร้อนครั้งที่เท่าไร,ครั้งที่ 29
เขตบริหารพิเศษฮ่องกง เข้าร่วมแข่งขันกีฬาโอลิมปิกฤดูร้อนครั้งที่ 29 ที่ประเทศอะไร,สาธารณรัฐประชาชนจีน
คิม ยอน-คยอง นักกีฬาวอลเลย์บอลหญิงทีมชาติเกาหลีใต้ เรียนชั้นมัธยมปลายที่โรงเรียนอะไร,โรงเรียนมัธยมปลายสตรีวิทยาการคอมพิวเตอร์ซูว็อน
โรงเรียนมัธยมปลายสตรีวิทยาการคอมพิวเตอร์ซูว็อน ตั้งอยู่ในจังหวัดใดของประเทศเกาหลีใต้,จังหวัดคย็องกี
พระราชชนนีในจักรพรรดิไทโช คือใคร,ซาราวาบิ โนะ สึโบเนะ
นารูโกะ ยานางิวาระเกิดที่ไหน,เกียวโต
ลาภิสรา อินทรสูต เกิดเมื่อไร,วันที่ 1 กันยายน พ.ศ. 2537
อุปกรณ์แปลงร่างที่เรียกว่า อุลตร้าแบดจ์ ของ ฮิงาชิ โคทาโร่ ทำให้แปลงร่างเป็นอะไร,อุลตร้าแมนทาโร่
อุลตร้าแมนทาโร่ในซีรีส์ได้รับเลือกให้เป็นผู้พิทักษ์โลกต่อจากใคร,อุลตร้าแมนเอช
บทละครเรื่องดารัมซาล่า ด้วยรักและศรัทธา ใครเป็นผู้กำกับการแสดง,โชคชัย เจริญสุข
นักแสดงนำละครเรื่องดารัมซาล่า ด้วยรักและศรัทธา ฝ่ายชายคือใคร,ไตรรงค์ ชัยนรานนท์
เครื่องราชอิศริยาภรณ์สหไมตรี เป็นชื่อของตระกูลเครื่องราชอิสริยาภรณ์ซึ่งมอบโดยรัฐบาลของประเทศอะไร,พระราชอาณาจักรกัมพูชา
เครื่องราชอิศริยาภรณ์สหไมตรี มีลำดับเกียรติทั้งหมดกี่ชั้น,5 ชั้น
เมืองที่มีความแห้งแล้งที่สุดในจังหวัดฮกไกโด ประเทศญี่ปุ่น คือเมืองอะไร,อาบาชิริ
เรือนจำอาบาชิริ ของประเทศญี่ปุ่นใช้กักขังนักโทษการเมืองในยุคใด,ยุคเมจิ
ผู้ถวายพระนมและการอภิบาลพระบาทสมเด็จพระจุลจอมเกล้าเจ้าอยู่หัว คือใคร,พระนมปริก
พระนมปริกได้แต่งงานกับใคร,นายเสถียรรักษา (เที่ยง)
ไมตรี ลิมปิชาติ เริ่มเขียนหนังสือตั้งแต่ปีพ.ศ. อะไร,ปีพ.ศ. ๒๕๑๓
ผลงานรวมเล่มเรื่องสั้นเล่มแรก ของนักเขียนไมตรี ลิมปิชาติ มีชื่อว่าอะไร,ทางออกที่ถูกปิด
สะเออะ เป็นอาหารของภาคใดในประเทศไทย,อีสาน
เรวิญานันท์ ทาเกิด หรือ เบญ เป็นจังหวัดอะไร,จังหวัดลำพูน
เรวิญานันท์ ทาเกิด จบการศึกษาจากคณะอะไร,คณะบริหารธุรกิจ
ซานลุยส์โปโตซีเป็นรัฐในประเทศอะไร,ประเทศเม็กซิโก
ทางทิศเหนือของรัฐซานลุยส์โปโตซี ประเทศแม็กซิโก มีอาณาเขตติดต่อกับรัฐใด,รัฐโกอาวีลา
สภาแห่งชาติเพื่อการฟื้นฟูติมอร์ ก่อตั้งโดยใคร,อดีตประธานาธิบดีชานานา กุฌเมา
ในเดือนมีนาคม พ.ศ. 2550 ได้มีการก่อตั้งพรรคการเมืองในประเทศติมอร์-เลสเต มีชื่อพรรคว่าอะไร,สภาแห่งชาติเพื่อการฟื้นฟูติมอร์
นายคำแหง พันธุ์มี นักมวยชาวจังหวัดอะไร,จังหวัดอุดรธานี
สถิติการชกของนายคำแหง พันธุ์มี ชนะน๊อคกี่ครั้ง,น็อค 2
เมืองท่าชายฝั่งที่มีชื่อเสียงทางภาคตะวันตกเฉียงใต้ของรัฐบริติชโคลัมเบีย ประเทศแคนาดา มีชื่อว่าอะไร,แวนคูเวอร์
ศูนย์กลางการถ่ายทำภาพยนตร์เป็นอันดับสามของอเมริกาเหนือคือเมืองอะไร,แวนคูเวอร์
ฟุตบอลประเพณีจุฬาฯ-ธรรมศาสตร์ ครั้งที่ 72 ใครเป็นเจ้าภาพ,จุฬาลงกรณ์มหาวิทยาลัย
สนามที่ใช้แข่งฟุตบอลประเพณีจุฬาฯ-ธรรมศาสตร์ ครั้งที่ 72 คือสนามอะไร,สนามศุภชลาศัย
